,listing_url,job_title,company,location,summary
99,http://www.indeed.com/rc/clk?jk=5c4d218db174cadb&fccid=80ea643d06fbcb78&vjs=3,Software Engineer - Back End,Upskill,"Austin, TX","Wearable technology is revolutionizing the enterprise and with our platform, Skylight, the largest companies in the world deliver more efficiently, with higher quality, and in a safer environment.
Skylight relies on a robust back-end service stack that coordinates and connects these wearable devices to the necessary business systems already in place. Our platform needs to be flexible enough to run in the cloud or in our customers’ data centers. Our customers are big and because of this we need to make sure that we put scalability, flexibility, and security first.
We’re looking for talented software engineers to add to the team that tackles these challenges. If you’re interested in building services that scale up to internet-scale or down to a single customer datacenter and have what it takes to work in a dynamic and fast-paced environment, we want to hear from you. The candidate selected for this position will: Work with product design and customer-facing teams to gather and verify requirements Own the implementation of one or more feature services or modules Be responsible for designing for testability and implementing automated tests Provide input during the architectural design process Be an active participant in iterating and improving engineering processes Occasionally work with customer-facing teams providing support to integration efforts
Successful candidates must demonstrate a passion not only for technology, but for our mission to elevate the impact of people in the connected industrial workspace. All applicants must have a BA/BS in Computer Science, a related technical field, or demonstrate equivalent work experience. Candidates hoping to be considered should demonstrate: A track record developing highly scalable, secure, production-grade back-end services Strong experience programming with either Go or NodeJS Strong knowledge of containerization using Docker Strong knowledge of the development of REST -based web services Proficiency with application frameworks such as Gokit , Express, or similar Proficiency with NoSQL data stores such as MongoDB, Couchbase , or similar Proficiency with relational data stores such as PostgreSQL, MySQL, or similar Proficiency with in-memory data stores such as Redis or memcached Knowledge of microservices architectural patterns Knowledge of major cloud providers such as AWS, GCP, or Azure Experience working on a DevOps team, using Git , and automation for CI/CD
Ideal candidates will build on top of that foundation and demonstrate: Knowledge of container orchestration utilizing Kubernetes, Docker Swarm, or similar Knowledge of service logging with the EFK stack or similar Knowledge of service monitoring with Prometheus or similar Knowledge of API management at scale

Compensation and Benefits Competitive salary commensurate with experience, including cash + equity Generous medical/dental/vision package Unlimited vacation policy; work hard and take time when you need it The freedom to think and create without boundaries

About Upskill
Recently recognized as a 2016 Technology Pioneer by the World Economic Forum, Upskill is the industry leader in wearable technology for the connected workforce. Our award-winning software platform, Skylight, powers wearable devices such as smart glasses, and is used by some of the largest and most recognized companies in the world. We help companies deliver their products and services more efficiently, with higher quality, and in a safer environment using our technology. We are in a brand-new industry that is transforming how hands-on work in complex manufacturing, field services, logistics and other sectors is getting done. To learn more about us, visit www.upskill.io."
100,http://www.indeed.com/rc/clk?jk=829ab2876717a93a&fccid=b5435bdc4be466ce&vjs=3,Software Engineer .NET,Tesla,"Fremont, CA","The Software Engineer role requires that the individual be a self-starter with demonstrated skills in .NET development, 3-tier application architecture and SQL Server schema design and T-SQL development and complete functional knowledge on HR process with integration with other areas.


Responsibilities:

Design and develop n-tier .NET web applications, web services, windows services for applications using ASP.NET, .NET, C#, JavaScript technologies and SQL Server
Design database schema, develop stored procedures and SQL Server Integration Services (SSIS) packages
Perform unit testing and troubleshooting applications built on ASP.NET, .NET, C#, JavaScript technologies and SQL Server
Practice standard development process leveraging agile methodologies such as SCRUM and Test Drive Development.
Consistently write, translate, and code software programs and applications according to specifications.
Functional knowledge on the end to end process, gathering business requirements, architecture of the solution design.
Create Functional and technical documents for software products using Visio, PowerPoint and Office.
Requirements:

Bachelor’s degree in engineering, computer science, information systems, or a related field from an accredited college or university is preferred
3+ years of experience designing/developing web applications for products using ASP.NET, .NET, C#, JavaScript technologies and SQL Server Design database schema, developing stored procedures (T-SQL) and SQL Server Integration Services (SSIS) packages
Full SDLC experience utilizing Scrum/Agile methodologies
Ability to complete all phases of software development life cycle including analysis, design, functionality, testing and support in HR is added advantage.
Ability to innovate and provide functional applications with intuitive interfaces
Proven analytical and problem-solving abilities.
Ability to effectively prioritize and execute tasks in a high-pressure environment.
Experience working both independently and in a team-oriented, collaborative environment.
Excellent communication skills.
Apply
Tesla participates in the E-Verify Program"
101,http://www.indeed.com/rc/clk?jk=abdf65531b1b1442&fccid=b2524f062a942b0c&vjs=3,"Software Engineer, Java/Scala",Guru,"Philadelphia, PA","---------

Overview:
---------

Located in Philadelphia and San Francisco, Guru is looking for an excellent Software Engineer to be a core part of our Data Science Team. You will work directly with the Data Scientists on delivering production ready implementations of our machine learning and artificial intelligence models. Your responsibilities include developing services directly tied to our AI initiatives, collaborating with the other backend engineers on building a strong service architecture and working with the Operations team to deliver your solutions.

This job is not only about how well you develop; it’s about how you lend your positivity and presence, combined with your skillset to an energized environment and highly collaborative team. Strong sense of humor required, sarcasm detection skills a plus.

-------------

Requirements:
-------------


Bachelor's degree in Computer Science, Engineering or related field, or equivalent training, fellowship, or work experience.
Expertise in Java/Scala and Python
Experience with Apache Spark
Experience designing and deploying production RESTful services in the cloud
General understanding of the data science technology landscape
Strong communication skills, a positive attitude, and empathy
Self-­awareness and a desire to continually improve
Desire to write and maintain clean code, avoiding tech debt

---------------------------

Preferred but not required:
---------------------------


Experience with Jetty or Spring
Experience with build systems like Maven
Understanding of micro-services architectures

----------------

Benefits to you:
----------------


Start-up experience = stock options
Competitive salary
Benefits (Health Care) contribution
The chance to contribute to an upbeat, fully engaged culture
Be a part of a winning team, failure is not an option

-----------

About Guru:
-----------

Guru is a dynamic, fast growing start-up in Philadelphia and San Francisco. Our mission is to reinvent the way people connect with meaningful information at work. Guru’s knowledge management solution provides customer-facing teams access to expert-verified information where they work and when they need it most. We believe in cultivating a welcoming, inclusive culture that encourages personal growth through working hard and having fun.

Launched in September 2015, our vision is backed by an amazing group of investors including FirstMark Capital, Salesforce, Michael Dell, the Slack Fund, and Emergence Capital. As we enter the next exciting stage of expansion, we're searching for passionate individuals to join our rapidly growing team.

This is a full-time position located in our Philadelphia office. Re-location and/or Visa Sponsorship is not included in our hiring package. Applicants will need to be authorized to work in the US.

We are an equal opportunity employer and value diversity at our company. We do not discriminate on the basis of race, religion, color, national origin, gender, sexual orientation, age, marital status, veteran status, or disability status."
102,http://www.indeed.com/rc/clk?jk=5b1561975a765b6a&fccid=a9bcf9da7de2f94a&vjs=3,Software Engineer (Cloud Foundry - Palo Alto),Pivotal Software,"Palo Alto, CA","Pivotal’s Story VIDEO ( https://www.youtube.com/watch?v=f-H1aJJpm0U )

Always be kind: a simple daily affirmation and one that feels more like a personal mission statement than a corporate motto -- but Pivotal isn’t just any corporation. Underpinning our world-class capabilities in cloud-native software delivery and agile development methodologies is one common thread: empathy. Not only do we want to transform the way the world builds software, we also want to make sure that sustainable pace, kindness, and diversity are at the core of every enterprise.

Known for taking an iterative approach, our 2000+ employees are empowered every day to help shape the way we build software. Pivotal is committed to open source, a diverse culture ( https://content.pivotal.io/blog/diversity-and-inclusion-in-everyday-work ), and fostering safe spaces for all of our individual employees.

You
---

You are looking for a collaborative environment building distributed systems that enable enterprises to focus on their business rather than re-architecting a cloud platform from scratch. Pair programming has always been something that you wanted to try out.

Furthering your education has always been a goal of yours. Learning new programming languages and getting to work with Golang piques your interest.

Contributing to open source software makes you feel good about the transparency it brings to an organization's code quality.

Us
--

Agile concepts are at the core of our process. We have a whole host of Pivotal Practices around Test Driven Development, pair programming, team retrospectives, technical retrospectives and continuous integration. We are excited to teach these to you and innovate with you on their implementation.

We stick to a strict 8 hour a day schedule (with flexible start and end times). Although on-call rotations are part of most teams, incidents are exceedingly rare.

We pair in small teams of 4 - 8 people in our Palo Alto office, located in the hills behind the Stanford campus. We use Slack ( https://slack.cloudfoundry.org/ ) to stay connected and Screenhero or Tmux for pairing. We are working hard to make sure that our distributed teams function as smoothly as our distributed systems.

You'll rarely be alone when developing; from pairing all day to 1 on 1 time with your manager, there is always a Pivot there to lend a helping hand. Mentorship from senior engineering leadership is built right into our process - you’ll always be empowered.

Making an investment in each Pivot’s professional development improves the organization as a whole. We encourage you to go to conferences or purchase those pricey O'Reilly books - and we’ll give you a budget each year to do it.

Your Day
--------

As cliche as it may sound, every day is completely different from the next. We have a general framework ( https://www.youtube.com/watch?v=gvjPSz8Xs7Q ) for what our day looks like and the majority of it will be spent with your pair:

9:06 AM - Office-wide stand-up to build office cohesion and start the day off together.

9:10 AM - Team standup - discuss any blockers, choose pairs, maybe even tell a joke.

9:30-12:30 PM - Start pairing, tackle an open GitHub issue and open a pull-request.

12:30-1:30 PM - Lunch! Grab food from one of the many nearby restaurants, run an errand, or join a book club.

1:31-6:00 PM - Get back with your pair and start an acceptance test for a big feature.

While that schedule does look busy, don’t worry - we take ample breaks throughout the day. Take a walk to look at horses, read a book on the patio, play a game of ping pong, or chat with co-workers at the snack bar. Sustainable pace is held in high regard. We know there is a life outside of work, we want you to be able to spend time with family and friends.

Desired Skills / Experience
---------------------------

We know from experience that not ticking every box on the skills sections stops many from applying. You should apply regardless of your self-assessment because we want to hear from you.


Ability to dive into a large polyglot codebase and contribute as you learn
Being okay with the uncomfortable feeling that comes from learning new things
Interest in exploring new programming paradigms, languages, and patterns
Demonstrable ability to research problems and break them into discrete parts

Nice to Haves
-------------


BA/BS in Computer Science or related field
Operations or Systems Administration experience, particularly on UNIX
Worked with large Go codebases
Experience with distributed systems and Linux containers
Used Test Driven Development (TDD) extensively
Worked in a pair programming environment
Contributed to an open source project
On-call experience with production grade systems
Has mentored others in a professional setting

Cloud Foundry engineers participate in an on-call rotation with their team to support software they work on.

Pivotal is an Equal Employment Opportunity employer that will consider all qualified applicants, regardless of race, color, religion, gender, sexual orientation, marital status, gender identity or expression, national origin, genetics, age, disability status, protected veteran status, or any other characteristic protected by applicable law."
103,http://www.indeed.com/rc/clk?jk=ecc77cf2082119b3&fccid=69c7d55b78dc7424&vjs=3,Software Engineer - New College Grad,Proofpoint,"Sunnyvale, CA","Company Overview
"
104,http://www.indeed.com/rc/clk?jk=d177e8c6178089f6&fccid=e6d4ba9e2cfe7902&vjs=3,"Software Engineer, Identity Platform",Atlassian,"Mountain View, CA","Job Description

Atlassian is looking for talented software engineers to build the next generation Identity Platform.
Over the last two years, Identity completely rebuilt their infrastructure around a micro services architecture with highly scalable services utilizing AWS resources. Aside from maintaining and growing user management features, Identity is responsible for operating its infrastructure reliably at a massive and constantly growing scale.
All products and services at Atlassian integrate with the Identity Platform, so you will collaborate with other Developer teams, Product Managers, Quality Engineers, and Support Engineers to ship an Identity experience that our users love. You will directly impact our customers' experience through the design and implementation of new features and functionalities. You will be a part of a small and high-energy team delivering improvements for our Identity infrastructure that powers all of our Cloud products.
More about you
On your first day, we'll expect you to have:
Specialization in Java and Spring Framework
Proven understanding of micro-services oriented architecture and extensible REST APIs
Experience with AWS cloud infrastructure
Fluency in any one database technology (e.g. RDBMS like Oracle or Postgres and/or NoSQL like DynamoDB or Cassandra)
Knowledge of the principles to construct fault-tolerance, reliability and durability within software systems
Knowledge to evaluate trade-offs between correctness, robustness, performance, space and time
Experience in taking ownership of features, while working with a team on short and long-running projects
It’s awesome, but not required if you have experience working with:
OAuth2, OpenID Connect, SAML protocols and encryption technologies
Relational databases, such as MySQL and PostgreSQL
Large scale distributed systems and event-driven architectures
Understanding of SaaS, PaaS, IaaS industry with hands on experience with public cloud offerings (e.g., AWS, GAE, Azure)
Familiarity with other programming languages and frameworks, such as Node.js, Scala, and Go
Practical knowledge of agile software development methodologies (e.g., XP, scrum)
Experience with continuous delivery and infrastructure as code
More about our team
We are a relatively new team within the larger Atlassian Platform services organization. We are always growing, learning, and adapting, in and out of the office, and are a team that's highly engaged and direct. We ask hard questions and support each other to constantly improve our work. We’re dedicated to being agile, which means we’re constantly learning about our users’ experience and iterating as much as necessary to improve. We also know all too well the importance of validating assumptions about users and use various types of testing to ensure we're right (or discover where we're wrong). It’s all about improving our user’s experience—no matter who or where it is. We live the company values with a strong customer focus and possess a healthy sense of urgency. We are a heavily data driven team, utilizing a variety of data collection, enrichment, analytics and visualizations to learn about our complex systems.
More about Atlassian
Software is changing the world, and we’re at the center of it all. With more than 80,000 global customers (including 85 of the Fortune 100) and a highly disruptive business model, we’re advancing the art of team collaboration with products like JIRA, Confluence and HipChat–and we’re just getting started. Driven by honest values, an amazing culture, and consistent revenue growth, we’re out to unleash the potential of every team. From Amsterdam and Austin to Sydney and San Francisco, we’re looking for people who are powered by passion and eager to do the best work of their lives in a highly autonomous yet collaborative, no B.S. environment.
We believe that the unique contributions of all Atlassians is the driver of our success. To make sure that our products and culture continue to incorporate everyone's perspectives and experience we never discriminate on the basis of race, religion, national origin, gender identity or expression, sexual orientation, age, or marital, veteran, or disability status. Qualifications

null

Additional Information

All your information will be kept confidential according to EEO guidelines."
105,http://www.indeed.com/rc/clk?jk=97ae588257cbb12c&fccid=049d8f5f8f382fd2&vjs=3,Jr Software Engineer,HealthAware LLC,"Denver, CO","HealthAware Jr. Software Engineer Description

About the Position:
The Jr. Software Engineer must integrate well with the culture of the organization and will have entry to mid-level experience. We value smart, efficient, effective, adaptive, experienced team players that care about results. We are currently expanding operations in conjunction with our innovative mobile program that facilitates patient behavior modification. Our new product delivers a better solution and consumer experience then current options in the marketplace as we attack a $162B opportunity in the healthcare space. You will be working with professionally accomplished leaders and developers in a strategic development role helping us build tools to generate broad domestic and global market penetration.

Appropriate candidates have meaningful experience:

2+ years of professional experience developing web applications
2+ years working with object-oriented PHP 5.6+
Understanding of basic agile development practices
Familiarity with MVC frameworks
Familiarity with basic user interface design standards (HTML5/4, CSS3/2)
Basic familiarity with coding languages include:
PHP
JavaScript
SQL (MySQL)

Familiarity with the following:

Linux
PHP 5.6+
MySQL Server 5.x
Apache 2.2+
Git
Testing
Personal skills to facilitate client support

Other important skills include:

Willingness to work with clients, both technical and non-technical
Strong desire to work for a growth company and contribute significantly
Strong time management skills
Strong analytical and quantitative skills
Strong written and verbal communications
Team player, positive attitude, a willingness to compromise and be collaborative.

Non-technical (culture alignment)


Strong desire to work for a mission driven company
Aligned with making a material difference in quality of life for a large population

Amenities & Benefits


We offer competitive salary
Full benefits including: Health, dental, vision, life, and 401k
Incentive bonus pay and generous PTO
Flexible remote working
Headquartered downtown Denver near Coors field

We’re a tight-knit group that enjoys in frequent company outings to happy hours, TopGolf and Rockies games.

U.S. citizens and those authorized to work in the U.S. are encouraged to apply. We are unable to sponsor at this time.This position is located in Denver Co. We are unable to provide relocation assistance."
