,listing_url,job_title,company,location,summary
49,http://www.indeed.com/rc/clk?jk=62a6b72ef0948d07&fccid=de71a49b535e21cb&vjs=3,Software Engineer - Automation,IBM,"Atlanta, GA","Job Description

The Weather Company, an IBM Business is seeking an Automation Engineer to
build automation and monitoring systems and tools for the Data Services Platform.
Work with hosted Kubernetes service, implement CI/CD pipelines, monitor and analyze service metrics, improve uptime and reliability of services across the platform.
Turn would-be manual tasks into simple push-button operations. Design and code the tools to make our applications run in data centers around the world.
Team up with application developers to turn code from git into running applications.
Deploy and manage containers deployed across multiple datacenters.
Design our infrastructure to handle enormous amounts of varying load.

Required Technical and Professional Expertise


An aversion to manual processes and the desire to automate
Knowledge of scripting languages such as Python or Ruby
Knowledge of regexes
Experience with config management systems
Understanding of Amazon Web Services or other cloud providers
Experience with continuous delivery and automation tools
Experience with service monitoring
Docker and Docker-related technologies
Kubernetes
Prometheus, Heapster, New Relic, Datadog

Preferred Tech and Prof Experience

Nice to have or be extremely enthusiastic to learn:

Consul, etcd
CDNs (Akamai or Level3)
Chef or Puppet
Helm, Kubeapps, Monocular, etc.
Memcached, Redis, Cassandra, Mongodb
Varnish
Building and deploying applications and release management
Jenkins, TeamCity, Bamboo, Travis or similar tools
Any emerging technology in the Devops space is a plus

EO Statement
IBM is committed to creating a diverse environment and is proud to be an equal opportunity employer. All qualified applicants will receive consideration for employment without regard to race, color, religion, gender, gender identity or expression, sexual orientation, national origin, genetics, disability, age, or veteran status. IBM is also committed to compliance with all fair employment practices regarding citizenship and immigration status."
50,http://www.indeed.com/rc/clk?jk=475757ca8ce94403&fccid=add1f8e3850daa11&vjs=3,Senior Software Engineer,KMM Technologies,"Frederick, MD","There are is a position available for a Senior Software Engineer


The position duties and requirements are as follows:


THE DUTIES INCLUDE:


Design and Implement SAS Enterprise Case Management(ECM) application. Construct UI definitions for case, Incident, and party objects. Create data grids in each User Definition file. Configure reference table values (lookup tables). Embed or link to SAS Visual Analytics reports through the Metadata server. Create 5 to 10 step non-complex workflows. Construct UI definitions for 4 case types with approximately 20 fields in each. Use ECM XML Generator and SAS Web Service to move alerts from data source to ECM as Incidents and/or Cases with conditional checking for existing alerts. Setup user accounts, groups, roles together with SAS platform administrator. Develop technical strategies and architectures for high-performance, scalable and complex enterprise-grade systems based on the analysis of the business goals, objectives, needs, and existing data systems infrastructure.


APPLICANT MUST HAVE
Degree in Engineering/Computer Science related. Master’s degree with 2 years or Bachelor’s degree with 5 years of work experience in software development.
Position requires experience in SAS Enterprise Case Management, SAS Enterprise Guide, SAS Web Service, SAS workflow studio, Base SAS/Macros, SAS Platform Metadata, SAS Stored Processes, SAS Visual Analytics, Oracle, PL/SQL, Shell Scripting, Windows, UNIX, XML.
Travel/Relocation to client sites;
Hours: M-F 40 hrs/wk. 9.00 a.m. to 6.00 p.m.;
Salary: $117,000 per year.

Please send resumes to support@KMMtechnologies.com ."
51,http://www.indeed.com/rc/clk?jk=e006e2e3606e857f&fccid=39cdc80b98113925&vjs=3,Software Engineer,Clarivate Analytics,"Park, IN","Clarivate Analytics clients are the trailblazers and risk takers who come up with life-changing ideas. We’re looking for our own trailblazers to help us keep providing clients some of the world’s most trusted brands, spanning scientific and academic research, patent analytics, pharmaceutical and biotech intelligence and IP management.
We’re an independent owned company with a rich heritage and a bold entrepreneurial mission. If you’re excited by the thought of helping people and organizations go from new ideas to life-changing innovations faster, we’re excited to consider you for a position at Clarivate.
Main Purpose of Role:
Software Developers are involved in all phases of a project including planning, development, testing and ongoing support.
Key desirable behaviors and experience:
Motivated independent self-starter; needs minimal supervision.
Displays knowledge and passion for technology.
Strives for a intelligent and feasible solution taking into account all aspects of the system
Rapidly picks up new scenarios during a testing/evaluation phase. Asks intelligent questions in response.
Understands business urgency and drives the team to hit delivery targets.
Duties and responsibilities:
Willingness to operate in a diverse platform
Develops, deploys and supports applications
Develops software solutions studying requirements
Ability to handle support and development work items from multiple projects concurrently
Analyzes requirements and contributes to the design, development and implementation
Willingness to learn new technologies, cross-train self and team members
Awareness with Agile project development methodology, SCRUM, continuous integration process.
Assists team lead with project development estimates and time lines.
Ensures adherence to all applicable standards
Qualifications:
BS/MS Degree in Computer Science, Software Engineering or equivalent.
Strong application focused development skills
Excellent conceptual and analytical skills.
Effective communicator at all levels, excellent inter-personal skills, strong business focus.
Highly self-motivated and confident to work on projects alone as well as in a team.
An enthusiastic approach to extending knowledge and learning new skills.
Strong commitment to quality of work and a good attention to detail.
Comfortable working in Linux, UNIX, Windows environments
Must be experienced with product/project life-cycle methodologies in a Unix/Linux server environment.
Technical Requirements:
Programming Languages and Skills – Java/J2ee, XML, XSLT,
Database - Oracle 10g + 11g, PL/SQL
Working knowledge of Unix Tool Sets.
Software –Eclipse, Ant, Subversion/CVS a plus.
Soft Skills:
Strong team player who is able to work well among and across other teams.
Must have excellent verbal and written communication skills.
Knowledge of project management methodologies is a plus.
Strong attention to detail and a positive attitude.
Demonstrable strong problem solving and analytical skills"
52,http://www.indeed.com/rc/clk?jk=f7945355dd086d5a&fccid=cd22d01053af7669&vjs=3,Full-Stack Web Developer,Oracle,"Pleasanton, CA","Full-Stack Web Developer-180005YS
Preferred Qualifications
Oracle Utilities software powers the utilities that serve millions of people around the world. Our software-as-a-service applications are applying cutting edge data analytics and behavioral insights to help customers understand and take control of their utility usage. We're looking to hire a full-stack software engineer to join our team in Pleasanton, CA.
About the team
The Digital Self Service engineering team is building a new cloud-based web application for utility customers to manage their accounts; from start/stop service, bill pay, providing insights about usage and billing, and giving energy saving tips, Oracle Utilities' Digital Self Service is the one SaaS web application that a utility needs to serve its customers. The focus will be on building with client-side web frameworks (e.g. AngularJS, React) and Java RESTful API services, but you will also collaborate with SOA frameworks, build & operate micro-services, and work with big-data sets, amongst other cool tech. We use agile practices, work in 1-3 week sprints, rely heavily on continuous integration, automated testing and best practices.
About you
Perhaps you only have deep experience on one side of the full-stack JS / Java development side, but you’re eager to learn new technologies and put them to use.
You want to own it. You embrace the challenges inherent in being fully responsible for an important part of the business, from supporting your applications in production to continuously monitoring and evolving it, based on performance metrics.
You enjoy the challenge of maintaining and evolving a large application ecosystem. Our software has tens of millions of users and has been in production for almost a decade. Diving deep into this code to make an extension or fix a defect is an opportunity, not a chore.
You're experienced with a modern service-based web stack: Javascript client-side apps, Java REST API services, databases. As a bonus, you've picked up deeper knowledge on things like caching, HTTP protocol, TCP/IP, Linux, etc.
You are passionate about JavaScript tools and frameworks and the future of JavaScript because of projects like Node, npm, Grunt, Gulp, Browserify, etc.
You're equally motivated to learn from others and be a mentor to junior team members.

Detailed Description and Job Requirements
 Analyze, design develop, troubleshoot and debug software programs for commercial or end user applications. Writes code, completes programming and performs testing and debugging of applications.

As a member of the software engineering division, you will perform detailed design based on provided high level design specifications. Assist in system planning, scheduling and implementation. Build enhancements (including new product features) and resolve bugs. Build and execute unit test and unit test plans. Review integration and regression test plans created by QA. Interact with QA and porting engineering about problems in the code.

Duties and tasks are standard with some variation; displays understanding of roles, processes and procedures. Performs moderately complex problem solving with assistance and guidance in understanding and applying company policies and processes. BS degree or equivalent experience relevant to functional area. 1 year of software engineering or related experience.

Oracle is an Equal Employment Opportunity Employer. All qualified applicants will receive consideration for employment without regard to race, color, religion, sex, national origin, sexual orientation, gender identity, disability and protected veterans status or any other characteristic protected by law."
53,http://www.indeed.com/rc/clk?jk=a1122ace54960f1f&fccid=fb74c70e196043bc&vjs=3,"Software Engineer, Calibration",Argo AI,"Mountain View, CA","Argo AI was founded to tackle one of the most challenging applications in computer science, robotics and artificial intelligence with self-driving vehicles. Argo AI is developing and deploying the latest advancements in artificial intelligence, machine learning and computer vision to help build safe and efficient self-driving vehicles that enable these transformations and more. The challenges are significant, but we are a team that believes in tackling hard, meaningful problems to improve the world. With offices in Pittsburgh, the Bay Area of California, Southeastern Michigan and Central New Jersey, we are building a high-performance team that is excited by complex engineering challenges and is passionate about making transportation safer, more affordable and accessible for all.

In particular, we are looking for candidates with sharpened skills that include:

Fundamental knowledge of computer vision areas: Image processing, pose estimation, calibration, structure from motion, optical flow, stereo vision.
Knowledge/experience in image formation, HDR imaging, and camera integration are a plus.
Strong software ability in C++ and/or Python.
Good communications skills.
Experience in Linux environments is desired.
Senior level industry experience: A MSc or PhD degree with 2+ years industry experience, or equivalent 6+ years industry experience.

Education:

A MSc or PhD degree with 2+ years industry experience, or equivalent 6+ years industry experience

At Argo AI, we have a strong emphasis on creating a highly effective team environment. Thus, we seek candidates that can work effectively with others across a broad range of disciplines.

Argo AI is an equal opportunity employer that believes in diversity as a strength.

We know it takes competitive benefits to fuel a team that works hard and enjoys the challenge. At Argo AI, you can expect stellar perks to support your best self:


Full, high quality health/dental/vision insurance
401(k) plan with employer match
Unlimited vacation
Competitive compensation packages
Flexible work locations
Free parking
Catered lunches and snacks
Fitness reimbursement
Commuter reimbursement

"
54,http://www.indeed.com/rc/clk?jk=3d62eb4ee78a1ae5&fccid=ab1a75477e45ce89&vjs=3,Software Engineer - Full Stack,Haven,"San Francisco, CA","About Haven

Haven is the SaaS-based technology company that thoughtfully advances global trade.

Global trade has grown beyond human scale. Increasingly complex routes and higher stakes demand more efficient systems. Haven believes open collaboration and access to information are key to enabling faster, smarter, and more reliable freight shipping. That’s why we build powerful technologies to foster improved communication between companies, decrease trade roadblocks, and mitigate the inherent risks in global trade. Haven is built for companies that ship large volumes of cargo in need of a powerful, easy-to-use tool that allows them to negotiate, ship, and track across thousands of providers and destinations through a single unified platform.

Software Engineer

As a full-stack senior software engineer at Haven you’ll flex your superior engineering skills and impressive architectural acumen to transform global trade. You’ll join a team of crazy smart engineers to remake the industry that moves 90% of all physical goods in the world. Day to day you’ll be a coder working on our platform using the StrongLoop/LoopBack application framework built on top of NodeJS and Express, with an AngularJS UI . You’ll embrace our lean approach towards product and development and jump aboard the MVP, test, iterate weekly or multiple times per week dev/release cycle.

About You


Skilled Node.js and Angular Developer
Product minded
Smart, efficient coder
Strong software design & architectural skills
Entrepreneurial thinker
Experience with agile, scrum, lean development
Amazon AWS experience a plus!
Strong Unix Skills (Have you compiled the kernel? points++)
Basic to Intermediate DevOps knowledge (calculate the netmask of a /27? Awesome!)
A friend to the product managers & designers of the world

Benefits


Yearly Travel Bonus
Unlimited vacation policy; work hard and take time when you need

"
55,http://www.indeed.com/rc/clk?jk=1ea253e7cfcb387c&fccid=eb96766cc31d9080&vjs=3,Software Engineer - University Grad,Rubrik,"Palo Alto, CA","Rubrik is creating the cloud data management space. We make it easy for businesses to protect, search, secure, and analyze all of their data simply and scalably. As cloud continues to grow at an astounding rate, we’ll be solving some of it’s most interesting challenges while building a product unlike anything seen before. This is a massive challenge and we’re just getting started so there is a lot of opportunity for personal growth and contribution.

We are looking for great engineers that are just starting out their career and want to be challenged, that want to work on meaningful projects with an amazing team, that want a lot of responsibility, that want to create a massive impact.

Your success is our number one priority. We don’t throw you in the deep end to sink or swim, but rather, have designed our onboarding process to focus on mentorship and scale up or down based on your needs. After onboarding, choose the project that interests you the most.

What are some cool things our new grads have done?


Erasure Coding ( https://www.rubrik.com/erasure-coding-rubrik-doubled-capacity-cluster/ ) - doubling the capacity of our clusters
Built an end to end custom reporting engine
Scaling our software to a 100-node cluster in AWS

Requirements:

BS, MS or PhD in Computer Science or related field of study
Strong in data structures, algorithms, and software design
Expert knowledge developing and debugging in C++, Java, or Scala
Large distributed systems design and development experience is a bonus
Strong interest in learning new technologies

Rubrik provides equal employment opportunities (EEO) to all employees and applicants for employment without regard to race, color, religion, sex, sexual orientation, gender identity, national origin, age or disability. In addition to federal law requirements, Rubrik complies with applicable state and local laws governing nondiscrimination in employment in every location in which the company has facilities. This policy applies to all terms and conditions of employment, including recruiting, hiring, placement, promotion, termination, layoff, recall, transfer, leaves of absence, compensation and training."
56,http://www.indeed.com/rc/clk?jk=50b5eeac00dc76dd&fccid=4e14eeb68ee3754f&vjs=3,Jr. Software Engineer (Java),Vibrent Health,"Fairfax, VA","Vibrent Health, a rapidly growing health-tech company is seeking a Jr. Software Engineer with a solid understand of design, data structure, and computer science fundamentals. The chosen candidate will have excellent communication skills to understand what the customer and the business needs and translate them into the right implementation of services and user interfaces.
We are looking for someone who enjoys working with server and mobile phone technologies and has a passion for making a difference in people’s lives.
Role & Responsibilities:
Design and implement key features in our enterprise-level web application with rich client-side functionality
Ability to dig into frameworks and libraries to troubleshoot issues outside the code you write
Write well designed, testable, efficient code while promoting best software development practices and embracing emerging standards
Manage your own time, and work well both independently and as part of a team.
Create and maintain software documentation
Our perfect candidate…
BS degree in Computer Science or equivalent practical experience.
1+ years of design and development of highly scalable web-based Java applications
Experience developing restful web services in Spring Framework
Experience with large scale enterprise server-based deployments (Kafka/Zookeper/Map Reduce, Spark, etc)
Experience with Hibernate/SQL
Familiar with modern JavaScript frameworks, preferably Angular
Experienced in Junit
Experienced in various version control tools such as SVN, Git
Familiar with Agile Software Development principal and tools
Ability to communicate to all levels of users (internal and external), strong problem-solving skills, adaptable, proactive and willing to take ownership.
We offer a total compensation package, growth opportunities, convenient northern Virginia location, stability and longevity as we are fully funded through a large grant for the next 5 years. We enjoy working with the latest tools and technologies including enterprise mobile apps, fitness sensors, medical devices, cloud computing, machine learning, big data and analytics. We partner with national leaders in healthcare, technology and research.
Vibrent is an exciting and innovative B2B2C SaaS-based mobile health technology company that stands at the epicenter of a global transformation in healthcare. We are seeking talented and experienced professionals who are highly motivated to be a part of something special. We are proud to be the chosen system for the Participant Technology Center of the White House’s high profile Precision Medicine Initiative: https://www.whitehouse.gov/the-press-office/2015/01/30/fact-sheet-president-obama-s-precision-medicine-initiative"
57,http://www.indeed.com/rc/clk?jk=5d386781217e6480&fccid=16af4e185a5d53e5&vjs=3,Junior Front End Software Engineer,Beckon,"San Mateo, CA","Junior Front End Software Engineer
"
58,http://www.indeed.com/rc/clk?jk=75319182af53f72d&fccid=b5435bdc4be466ce&vjs=3,Front End Software Engineer - Energy Software,Tesla,"Palo Alto, CA","Seeking a highly motivated software engineer specializing in full-stack web development to join our team. We’re continuously delivering new features and improvements to our customers. Our mobile applications allow customers to interact with their cars and energy products via real-time, low-latency two-way communication. We also build tools for our internal sales, delivery, and service teams.


You’ll join a small team that develops full-stack software systems, with a particular focus on front-end Javascript development, for our energy product lines and IoT platform. The ideal candidate will have a passion for building highly visible, world-class software and a track record of success in creating reliable and scalable software. To be successful in this role, you will need strong software engineering skills, excellent interpersonal communication, and experience accepting and giving meaningful feedback on technical designs and code reviews.


Responsibilities

Design, develop, and maintain software systems focusing on data visualization and assisting with distributed command and control of distributed energy resources
Contribute to projects focusing on ingesting, querying, and processing data
Collaborate with colleagues in design and code reviews
Develop means for deploying, scaling, and monitoring software systems
Characterize complex problems related to the scalability, reliability, performance, and security of our systems
Owns projects and always seeks ways to improve efficiency and operations
Drive and contribute to other projects as required or as business needs change
Requirements

Bachelor’s degree or higher in computer science, engineering or equivalent in experience
Minimum 2 years of working experience
Proficient in web technologies: Javascrpt, HTML, CSS, modern task runners and testing tools (ex: webpack, karma, gulp)
Experienced with web app MVC frameworks/libraries: AngularJS, ReactJS (including: flux, redux)
Adept in at least one additional programming/scripting language (e.g. python, golang, java, C#)
Understanding of SQL, database design and modeling
Experience in building scalable systems
Understanding of automated testing, deployment process and tools
Excellent written and verbal communication skills
Passionate in writing clean code and creating world-class software
Apply
Tesla participates in the E-Verify Program"
